{
  "secondsSinceInput": 3600,
  "sysfsRoot": "tests/fixtures/sysfs/type-unreadable",
  "cpuCores": 4,
  "cpuLoad1m": 0.1,
  "memoryTotalMb": 8192,
  "memoryFreeMb": 4096,
  "gpuPresent": false,
  "gpuName": null,
  "gpuFreeMb": null,
  "localModelsReachable": false,
  "localModels": [],
  "hostAlias": "desktop",
  "policyAllowedWindowStart": "08:00",
  "policyAllowedWindowEnd": "22:00",
  "timestamp": "2026-10-27T12:00:00.000Z"
}
