{
  "secondsSinceInput": 1500,
  "acPower": false,
  "batteryPercent": 34,
  "cpuCores": 8,
  "cpuLoad1m": 0.4,
  "memoryTotalMb": 16384,
  "memoryFreeMb": 9000,
  "gpuPresent": false,
  "gpuName": null,
  "gpuFreeMb": null,
  "localModelsReachable": false,
  "localModels": [],
  "hostAlias": "laptop-b"
}
